{
  "$schema": "https://json-schema.org/draft/2020-12/schema",
  "$id": "https://schemas.cdsoft.com.cn/vastplan/composition/frontend/v1/vastplan.portal-platform-catalog.schema.json",
  "title": "VastPlan Portal Platform Catalog v1",
  "type": "object",
  "additionalProperties": false,
  "required": ["version", "revision", "id", "profiles", "bindings"],
  "properties": {
    "version": { "$ref": "https://schemas.cdsoft.com.cn/vastplan/composition/common/v1/vastplan.composition-common.schema.json#/$defs/version" },
    "revision": { "$ref": "https://schemas.cdsoft.com.cn/vastplan/composition/common/v1/vastplan.composition-common.schema.json#/$defs/revision" },
    "id": { "$ref": "https://schemas.cdsoft.com.cn/vastplan/composition/common/v1/vastplan.composition-common.schema.json#/$defs/compositionId" },
    "profiles": {
      "type": "array",
      "minItems": 1,
      "items": { "$ref": "https://schemas.cdsoft.com.cn/vastplan/composition/frontend/v1/vastplan.platform-profile.schema.json" }
    },
    "bindings": {
      "type": "array",
      "minItems": 1,
      "items": { "$ref": "#/$defs/portalBinding" }
    },
    "browserExposure": {
      "$ref": "#/$defs/browserExposure"
    }
  },
  "$defs": {
    "governedName": { "type": "string", "pattern": "^[A-Za-z0-9][A-Za-z0-9._-]{0,159}$" },
    "operationList": {
      "type": "array",
      "minItems": 1,
      "uniqueItems": true,
      "items": { "$ref": "#/$defs/governedName" }
    },
    "capabilityGrant": {
      "type": "object",
      "additionalProperties": false,
      "required": ["capability"],
      "properties": {
        "capability": { "$ref": "#/$defs/governedName" },
        "read": { "$ref": "#/$defs/operationList" },
        "write": { "$ref": "#/$defs/operationList" }
      }
    },
    "browserExposure": {
      "type": "object",
      "additionalProperties": false,
      "properties": {
        "disabledPlugins": {
          "type": "array",
          "uniqueItems": true,
          "items": { "$ref": "#/$defs/governedName" }
        },
        "disabledOperations": {
          "type": "array",
          "uniqueItems": true,
          "items": {
            "type": "object",
            "additionalProperties": false,
            "required": ["pluginId", "capability", "operation"],
            "properties": {
              "pluginId": { "$ref": "#/$defs/governedName" },
              "capability": { "$ref": "#/$defs/governedName" },
              "operation": { "$ref": "#/$defs/governedName" }
            }
          }
        }
      }
    },
    "managedService": {
      "type": "object",
      "additionalProperties": false,
      "required": ["id", "logicalService", "routingDomain", "capabilities"],
      "properties": {
        "id": { "$ref": "#/$defs/governedName" },
        "label": { "type": "string", "minLength": 1, "maxLength": 160 },
        "logicalService": { "$ref": "#/$defs/governedName" },
        "routingDomain": { "$ref": "#/$defs/governedName" },
        "resource": { "$ref": "#/$defs/managedResource" },
        "capabilities": {
          "type": "array",
          "minItems": 1,
          "items": { "$ref": "#/$defs/capabilityGrant" }
        },
        "apis": {
          "type": "array",
          "maxItems": 32,
          "items": { "$ref": "#/$defs/managementAPI" }
        }
      }
    },
    "managedResource": {
      "type": "object",
      "additionalProperties": false,
      "required": ["kind", "kernel", "deployment", "unitId"],
      "properties": {
        "kind": { "const": "service-unit" },
        "kernel": { "const": "backend" },
        "deployment": { "$ref": "#/$defs/governedName" },
        "unitId": { "$ref": "#/$defs/governedName" }
      }
    },
    "managementAPI": {
      "type": "object",
      "additionalProperties": false,
      "required": ["id", "contractId", "contractVersion", "contractDigest"],
      "properties": {
        "id": { "$ref": "#/$defs/governedName" },
        "contractId": { "$ref": "https://schemas.cdsoft.com.cn/vastplan/api/v1/vastplan.api-exposure.schema.json#/$defs/governedId" },
        "contractVersion": { "$ref": "https://schemas.cdsoft.com.cn/vastplan/api/v1/vastplan.api-exposure.schema.json#/$defs/semver" },
        "contractDigest": { "$ref": "https://schemas.cdsoft.com.cn/vastplan/api/v1/vastplan.api-exposure.schema.json#/$defs/sha256" }
      }
    },
    "portalBinding": {
      "type": "object",
      "additionalProperties": false,
      "required": ["tenantId", "portalId", "platformProfile", "services"],
      "properties": {
        "tenantId": { "type": "string", "minLength": 1, "maxLength": 160 },
        "portalId": { "$ref": "https://schemas.cdsoft.com.cn/vastplan/composition/common/v1/vastplan.composition-common.schema.json#/$defs/compositionId" },
        "platformProfile": { "$ref": "https://schemas.cdsoft.com.cn/vastplan/composition/common/v1/vastplan.composition-common.schema.json#/$defs/compositionRef" },
        "services": {
          "type": "array",
          "minItems": 1,
          "items": { "$ref": "#/$defs/managedService" }
        }
      }
    }
  }
}
