{
  "version": 1,
  "revision": 81,
  "id": "local-portal-platform",
  "profiles": [
    {
      "version": 1,
      "revision": 81,
      "id": "portal-default",
      "target": { "kernel": "frontend" },
      "updates": { "mode": "automatic" },
      "runtimeEngine": {
        "id": "cn.vastplan.foundation.frontend.runtime.engine.react",
        "version": "1.1.2",
        "channel": "stable",
        "engineContract": "^1.0.0",
        "family": "react"
      },
      "renderAdapter": {
        "id": "cn.vastplan.foundation.frontend.render.adapter",
        "version": "5.1.3",
        "channel": "stable",
        "uiContract": "^8.0.0",
        "config": {
          "defaultRenderer": "antd",
          "allowedRenderers": ["antd", "arco", "mui"],
          "userSelectable": true,
          "rendererOptions": {
            "antd": { "themeTemplate": "light", "allowedThemeTemplates": ["light", "dark"], "themeUserSelectable": true, "iconTheme": "canonical", "allowedIconThemes": ["canonical", "renderer-native"], "iconUserSelectable": true },
            "arco": { "themeTemplate": "light", "allowedThemeTemplates": ["light", "dark"], "themeUserSelectable": true, "iconTheme": "canonical", "allowedIconThemes": ["canonical", "renderer-native"], "iconUserSelectable": true },
            "mui": { "themeTemplate": "light", "allowedThemeTemplates": ["light", "dark"], "themeUserSelectable": true, "iconTheme": "canonical", "allowedIconThemes": ["canonical", "renderer-native"], "iconUserSelectable": true }
          }
        }
      },
      "shell": {
        "id": "cn.vastplan.foundation.frontend.structure.shell",
        "version": "5.1.0",
        "channel": "stable",
        "uiContract": "^8.0.0",
        "config": {
          "defaultTemplate": "standard",
          "allowedTemplates": ["standard", "top-navigation"],
          "userSelectable": true,
          "templateOptions": {
            "standard": { "pageBodyWidth": "fluid" },
            "top-navigation": { "pageBodyWidth": "fluid" }
          },
          "navigationGroups": [
            { "id": "platform.artifacts", "label": "制品仓库", "zone": "settings", "icon": "settings", "parentID": "settings", "order": 50 },
            { "id": "platform.api-exposure", "label": "API 暴露", "zone": "settings", "icon": "settings", "parentID": "settings", "order": 55 },
            { "id": "platform.authorization", "label": "角色与权限", "zone": "settings", "icon": "settings", "parentID": "settings", "order": 60 }
          ]
        }
      },
      "workbench": {
        "id": "cn.vastplan.foundation.frontend.workflow.workbench",
        "version": "5.2.3",
        "channel": "stable",
        "uiContract": "^8.0.0"
      },
      "plugins": [
        { "id": "cn.vastplan.foundation.frontend.runtime.engine.react", "version": "1.1.2", "channel": "stable" },
        { "id": "cn.vastplan.foundation.frontend.render.adapter", "version": "5.1.3", "channel": "stable" },
        { "id": "cn.vastplan.foundation.frontend.render.adapter.antd", "version": "5.1.3", "channel": "stable" },
        { "id": "cn.vastplan.foundation.frontend.render.adapter.arco", "version": "5.1.1", "channel": "stable" },
        { "id": "cn.vastplan.foundation.frontend.render.adapter.mui", "version": "5.1.2", "channel": "stable" },
        { "id": "cn.vastplan.foundation.frontend.structure.shell", "version": "5.1.0", "channel": "stable" },
        { "id": "cn.vastplan.foundation.frontend.structure.layout.standard", "version": "5.1.0", "channel": "stable" },
        { "id": "cn.vastplan.foundation.frontend.structure.layout.top-navigation", "version": "5.1.0", "channel": "stable" },
        { "id": "cn.vastplan.foundation.frontend.workflow.workbench", "version": "5.2.3", "channel": "stable" },
        { "id": "cn.vastplan.platform.configuration.portal-composer", "version": "4.0.4", "channel": "stable" },
        { "id": "cn.vastplan.platform.configuration.global-settings", "version": "0.8.10", "channel": "stable" },
        { "id": "cn.vastplan.platform.configuration.plugin-settings", "version": "0.13.7", "channel": "stable" },
        { "id": "cn.vastplan.platform.security.credentials", "version": "0.12.9", "channel": "stable" },
        { "id": "cn.vastplan.platform.data.relational.connection-manager", "version": "0.9.9", "channel": "stable" },
        { "id": "cn.vastplan.platform.artifacts.repository", "version": "0.35.7", "channel": "stable" },
        { "id": "cn.vastplan.platform.integration.api-exposure", "version": "0.5.9", "channel": "stable" },
        { "id": "cn.vastplan.platform.infrastructure.deployment-manager", "version": "0.21.6", "channel": "stable" },
        { "id": "cn.vastplan.platform.security.authorization-policy", "version": "0.5.4", "channel": "stable" }
      ],
      "security": { "firstPartyOnly": true, "requireIntegrity": true }
    }
  ],
  "bindings": [
    {
      "tenantId": "local",
      "portalId": "operations",
      "platformProfile": {
        "id": "portal-default",
          "revision": 81,
          "digest": "35726a6e2725e71441dc1f351188f5817e7f01effe08a5150d0b12a9ace61da2"
      },
      "services": [
        {
          "id": "settings",
          "label": "全局设置服务",
          "logicalService": "platform.settings",
          "routingDomain": "platform",
          "capabilities": [
            { "capability": "platform.settings", "read": ["list"], "write": ["put", "delete"] }
          ]
        },
        {
          "id": "plugin-configuration",
          "label": "插件配置服务",
          "logicalService": "platform.plugin-configuration",
          "routingDomain": "platform",
          "capabilities": [
            { "capability": "platform.plugin-configuration", "read": ["listDefinitions", "getDefinition", "listCandidates", "listResourceItems", "getResourceItem"], "write": ["createDraft", "discardDraft", "submitDraft", "activateCandidate", "submitProfileDraft", "approveProfileCandidate", "activateProfileCandidate", "abortProfileCandidate", "submitHotServiceDraft", "approveHotServiceCandidate", "activateHotServiceCandidate", "abortHotServiceCandidate", "submitScopedDraft", "approveScopedCandidate", "activateScopedCandidate", "abortScopedCandidate", "createResourceDraft", "updateResourceDraft", "deleteResourceDraft", "submitResourceDraft", "approveResourceCandidate", "activateResourceCandidate", "abortResourceCandidate"] }
          ]
        },
        {
          "id": "credentials",
          "label": "凭证管理服务",
          "logicalService": "platform.credentials",
          "routingDomain": "platform",
          "capabilities": [
            { "capability": "platform.credentials", "read": ["list", "listManagedAudit"], "write": ["put", "rotate", "revoke"] }
          ]
        },
        {
          "id": "database",
          "label": "数据库服务",
          "logicalService": "platform.database",
          "routingDomain": "platform",
          "capabilities": [
            { "capability": "platform.database", "read": ["list"], "write": ["define", "remove", "probe"] }
          ]
        },
        {
          "id": "api-exposure",
          "label": "API 暴露服务",
          "logicalService": "platform.api-exposure",
          "routingDomain": "platform",
          "capabilities": [
            { "capability": "platform.api-exposure", "read": ["list", "listDataPlanes", "apiList"], "write": ["createDraft", "updateDraft", "submit", "approve", "publish", "retire", "createDataPlaneDraft", "submitDataPlane", "approveDataPlane", "publishDataPlane", "retireDataPlane", "apiCreateDraft", "apiUpdateDraft", "apiSubmit", "apiApprove", "apiPublish", "apiRetire"] }
          ],
          "apis": [
            {
              "id": "primary",
              "contractId": "platform.api-exposure.management-api",
              "contractVersion": "1.0.0",
              "contractDigest": "740b9847429ae4e42fc742f50043f7615633c1520d66bbd1f9548ae2dc7d9e19"
            }
          ]
        },
        {
          "id": "artifacts",
          "label": "制品仓库服务",
          "logicalService": "platform.artifacts.repository",
          "routingDomain": "platform",
          "capabilities": [
            { "capability": "platform.artifacts.repository", "read": ["status", "assessmentInventory", "prepareAssessmentReport", "capacity", "listCatalog", "listPublishJournal", "resolve", "listReferences", "gcPlan", "gcStatus", "migrationStatus", "listPublications", "getSupplyChainEvidence"], "write": ["setLifecycle", "gcQuarantine", "gcSweep", "prepareMigration", "syncMigration", "cutoverMigration", "rollbackMigration", "finalizeMigration", "releaseMigration", "submitPublication", "approvePublication", "rejectPublication", "cancelPublication"] }
          ]
        },
        {
          "id": "deployment",
          "label": "部署管理服务",
          "logicalService": "platform.deployment",
          "routingDomain": "platform",
          "capabilities": [
            { "capability": "platform.deployment", "read": ["listNodes", "listBootstrapJobs", "listDeploymentTargets", "listServiceRevisions", "listServiceRevisionAudit", "listTestTargetBindings", "listTestReleases"], "write": ["putNode", "createBootstrap", "approveBootstrap", "createIntentDraft", "updateIntentDraft", "refreshIntentDraft", "submitServiceDraft", "approveServiceRevision", "publishServiceRevision", "rollbackServiceRevision", "putTestTargetBinding", "createTestRelease", "rollbackTestRelease"] }
          ]
        },
        {
          "id": "authorization",
          "label": "角色与权限服务",
          "logicalService": "platform.authorization",
          "routingDomain": "security",
          "capabilities": [
            { "capability": "platform.authorization", "read": ["get", "listAudit"], "write": ["createRole", "updateRole", "submitRole", "approveRole", "publishRole", "retireRole", "createBinding", "updateBinding", "submitBinding", "approveBinding", "publishBinding", "retireBinding", "revoke", "publishSnapshot"] }
          ]
        }
      ]
    }
  ]
}
